{
  "schemaVersion": "1.0.0",
  "keyId": "nara-stage2-dev-2026",
  "algorithm": "ecdsa-p256-sha256",
  "contentSha256": "8c78fc32ad9047531caa9a910f85381c423bbd9f9a7730103dd47ff161a93966",
  "signatureBase64": "MEUCIQCAlBx2X9ME/nRitIY6cX/0Va/a6Wiorga6v9ml8aFSwAIgWAjrg/5POIZMbS/KpRV3/0b50zOaVNzIMoYEkSSe4UA="
}
